{
  "generatedAt": "2026-05-25T04:03:32.183Z",
  "runId": "live-full",
  "model": null,
  "codexVersion": "codex-cli 0.132.0",
  "evalVersion": "1.0.0",
  "layers": {
    "extraction": {
      "metrics": {
        "extractionPrecision": {
          "mean": 1,
          "n": 3
        },
        "extractionRecall": {
          "mean": 1,
          "n": 3
        },
        "extractionF1": {
          "mean": 1,
          "n": 3
        },
        "extractionNumericWithinTolerance": {
          "mean": 1,
          "n": 3
        }
      },
      "counts": {
        "deals": 3,
        "byLayer": {
          "extraction": 3
        },
        "partialFailures": 0
      },
      "deals": [
        {
          "dealId": "cp-stabilized-clean",
          "layer": "extraction",
          "archetype": "core-plus",
          "extraction": {
            "precision": 1,
            "recall": 1,
            "f1": 1,
            "numericWithinTolerance": 1,
            "matched": 12,
            "extractedCount": 14,
            "groundTruthCount": 12,
            "perField": [
              {
                "path": "rent_roll::property.totalUnits",
                "expected": 120,
                "actual": 120,
                "matched": true,
                "present": true
              },
              {
                "path": "rent_roll::financials.inPlaceOccupancy",
                "expected": 0.9417,
                "actual": 0.9417,
                "matched": true,
                "present": true
              },
              {
                "path": "rent_roll::financials.grossPotentialRentAnnual",
                "expected": 2894400,
                "actual": 2894400,
                "matched": true,
                "present": true
              },
              {
                "path": "rent_roll::financials.inPlaceRentAnnual",
                "expected": 2631900,
                "actual": 2631900,
                "matched": true,
                "present": true
              },
              {
                "path": "t12::financials.trailingT12Revenue",
                "expected": 2360000,
                "actual": 2360000,
                "matched": true,
                "present": true
              },
              {
                "path": "t12::financials.trailingT12Expenses",
                "expected": 1210000,
                "actual": 1210000,
                "matched": true,
                "present": true
              },
              {
                "path": "t12::financials.currentNOI",
                "expected": 1150000,
                "actual": 1150000,
                "matched": true,
                "present": true
              },
              {
                "path": "offering_memo::financials.askingPrice",
                "expected": 19170000,
                "actual": 19170000,
                "matched": true,
                "present": true
              },
              {
                "path": "offering_memo::property.totalUnits",
                "expected": 120,
                "actual": 120,
                "matched": true,
                "present": true
              },
              {
                "path": "offering_memo::property.yearBuilt",
                "expected": 2008,
                "actual": 2008,
                "matched": true,
                "present": true
              },
              {
                "path": "offering_memo::financials.inPlaceOccupancy",
                "expected": 0.94,
                "actual": 0.94,
                "matched": true,
                "present": true
              },
              {
                "path": "offering_memo::financials.currentNOI",
                "expected": 1150000,
                "actual": 1150000,
                "matched": true,
                "present": true
              }
            ]
          },
          "financials": null,
          "redFlags": null,
          "dealbreakers": null,
          "verdict": null,
          "partialFailure": null
        },
        {
          "dealId": "ds-occupancy-collapse",
          "layer": "extraction",
          "archetype": "distressed",
          "extraction": {
            "precision": 1,
            "recall": 1,
            "f1": 1,
            "numericWithinTolerance": 1,
            "matched": 12,
            "extractedCount": 14,
            "groundTruthCount": 12,
            "perField": [
              {
                "path": "rent_roll::property.totalUnits",
                "expected": 150,
                "actual": 150,
                "matched": true,
                "present": true
              },
              {
                "path": "rent_roll::financials.inPlaceOccupancy",
                "expected": 0.62,
                "actual": 0.62,
                "matched": true,
                "present": true
              },
              {
                "path": "rent_roll::financials.grossPotentialRentAnnual",
                "expected": 2676000,
                "actual": 2676000,
                "matched": true,
                "present": true
              },
              {
                "path": "rent_roll::financials.inPlaceRentAnnual",
                "expected": 1512960,
                "actual": 1512960,
                "matched": true,
                "present": true
              },
              {
                "path": "t12::financials.trailingT12Revenue",
                "expected": 1120000,
                "actual": 1120000,
                "matched": true,
                "present": true
              },
              {
                "path": "t12::financials.trailingT12Expenses",
                "expected": 1066000,
                "actual": 1066000,
                "matched": true,
                "present": true
              },
              {
                "path": "t12::financials.currentNOI",
                "expected": 54000,
                "actual": 54000,
                "matched": true,
                "present": true
              },
              {
                "path": "offering_memo::financials.askingPrice",
                "expected": 9800000,
                "actual": 9800000,
                "matched": true,
                "present": true
              },
              {
                "path": "offering_memo::property.totalUnits",
                "expected": 150,
                "actual": 150,
                "matched": true,
                "present": true
              },
              {
                "path": "offering_memo::property.yearBuilt",
                "expected": 1989,
                "actual": 1989,
                "matched": true,
                "present": true
              },
              {
                "path": "offering_memo::financials.inPlaceOccupancy",
                "expected": 0.62,
                "actual": 0.62,
                "matched": true,
                "present": true
              },
              {
                "path": "offering_memo::financials.currentNOI",
                "expected": 54000,
                "actual": 54000,
                "matched": true,
                "present": true
              }
            ]
          },
          "financials": null,
          "redFlags": null,
          "dealbreakers": null,
          "verdict": null,
          "partialFailure": null
        },
        {
          "dealId": "va-overlevered-ltv",
          "layer": "extraction",
          "archetype": "value-add",
          "extraction": {
            "precision": 1,
            "recall": 1,
            "f1": 1,
            "numericWithinTolerance": 1,
            "matched": 12,
            "extractedCount": 14,
            "groundTruthCount": 12,
            "perField": [
              {
                "path": "rent_roll::property.totalUnits",
                "expected": 156,
                "actual": 156,
                "matched": true,
                "present": true
              },
              {
                "path": "rent_roll::financials.inPlaceOccupancy",
                "expected": 0.9103,
                "actual": 0.9103,
                "matched": true,
                "present": true
              },
              {
                "path": "rent_roll::financials.grossPotentialRentAnnual",
                "expected": 3224160,
                "actual": 3224160,
                "matched": true,
                "present": true
              },
              {
                "path": "rent_roll::financials.inPlaceRentAnnual",
                "expected": 2730720,
                "actual": 2730720,
                "matched": true,
                "present": true
              },
              {
                "path": "t12::financials.trailingT12Revenue",
                "expected": 2120000,
                "actual": 2120000,
                "matched": true,
                "present": true
              },
              {
                "path": "t12::financials.trailingT12Expenses",
                "expected": 1160000,
                "actual": 1160000,
                "matched": true,
                "present": true
              },
              {
                "path": "t12::financials.currentNOI",
                "expected": 960000,
                "actual": 960000,
                "matched": true,
                "present": true
              },
              {
                "path": "offering_memo::financials.askingPrice",
                "expected": 18400000,
                "actual": 18400000,
                "matched": true,
                "present": true
              },
              {
                "path": "offering_memo::property.totalUnits",
                "expected": 156,
                "actual": 156,
                "matched": true,
                "present": true
              },
              {
                "path": "offering_memo::property.yearBuilt",
                "expected": 2001,
                "actual": 2001,